<?xml version="1.0" encoding="ISO-8859-1"?>

<!-- project.xml - (ldn)demo - containing the same set of modules as the
     extended set, with a complete, ready to run pre-configuration. 
     Has to keep synchronized with the extended bundle!                      -->

<ccm:project   xmlns:xsi="http://www.w3.org/2001/XMLSchema-instance" 
               xmlns:ccm="http://ccm.redhat.com/ccm-project" 
              ccmVersion="6.1" 
                    name="aplaws" 
              prettyName="APLAWS plus Demo Spin"
                 version="1-1-5" 
                 release="-demo" 
                  webxml="web.xml-aplaws" 
                  webapp="ROOT"
      xsi:schemaLocation="http://ccm.redhat.com/ccm-project file:tools-ng/common/xsd/project.xsd">

<ccm:databases>
        <ccm:database name="postgres"/>
</ccm:databases>


  <ccm:build>
        <!--  Main apps   -->
        <ccm:application name="ccm-core"/>
        <ccm:application name="ccm-cms"/>

        <!--  Content assets   -->
        <ccm:application name="ccm-cms-assets-fileattachment"/>
        <ccm:application name="ccm-cms-assets-imagestep"/>
        <ccm:application name="ccm-cms-assets-notes"/>
        <ccm:application name="ccm-cms-assets-relatedlink"/>

        <!--  Content types   -->
        <ccm:application name="ccm-cms-types-agenda"/>
        <ccm:application name="ccm-cms-types-article"/>
        <ccm:application name="ccm-cms-types-bookmark"/>
        <ccm:application name="ccm-cms-types-contact"/>
        <ccm:application name="ccm-cms-types-esdservice"/>
        <ccm:application name="ccm-cms-types-event"/>
        <ccm:application name="ccm-cms-types-faqitem"/>
        <ccm:application name="ccm-cms-types-filestorageitem"/>
        <ccm:application name="ccm-cms-types-formitem"/>
        <ccm:application name="ccm-cms-types-formsectionitem"/>
        <ccm:application name="ccm-cms-types-glossaryitem"/>
        <ccm:application name="ccm-cms-types-htmlform"/>
        <ccm:application name="ccm-cms-types-image"/>
        <ccm:application name="ccm-cms-types-inlinesite"/>
        <ccm:application name="ccm-cms-types-job"/>
        <ccm:application name="ccm-cms-types-legalnotice"/>
        <ccm:application name="ccm-cms-types-minutes"/>
        <ccm:application name="ccm-cms-types-mparticle"/>
        <ccm:application name="ccm-cms-types-newsitem"/>
        <ccm:application name="ccm-cms-types-organization"/>
        <ccm:application name="ccm-cms-types-pressrelease"/>
        <ccm:application name="ccm-cms-types-service"/>
        <ccm:application name="ccm-cms-types-simpleaddress"/>
        <!-- siteproxy is a prerequisite for ccm-ldn-atoz  -->
        <ccm:application name="ccm-cms-types-siteproxy"/>
        <ccm:application name="ccm-cms-types-xmlfeed"/>

        <!--  Applications   -->
        <ccm:application name="ccm-ldn-aplaws"/>
        <ccm:application name="ccm-ldn-atoz"/>
        <ccm:application name="ccm-ldn-dublin"/>
        <ccm:application name="ccm-ldn-exporter"/>
        <ccm:application name="ccm-ldn-freeform"/>
        <ccm:application name="ccm-ldn-importer"/>
        <ccm:application name="ccm-ldn-navigation"/>
        <ccm:application name="ccm-ldn-rss"/>
        <ccm:application name="ccm-ldn-search"/>
        <ccm:application name="ccm-ldn-shortcuts"/>
        <ccm:application name="ccm-ldn-subsite"/>
        <ccm:application name="ccm-ldn-terms"/>
        <ccm:application name="ccm-ldn-util"/>

        <!--  Extra apps   -->
        <ccm:application name="ccm-docrepo"/>
        <ccm:application name="ccm-faq"/>
        <ccm:application name="ccm-forum"/>     
        <ccm:application name="ccm-forum-categorised"/>     
        <ccm:application name="ccm-portalserver"/>
        <ccm:application name="ccm-portalworkspace"/>
        <ccm:application name="ccm-themedirector"/>


<!-- tools will be downloaded from trunk, but does not
     contain java code to be compiled!
        <ccm:application name="tools"/>           -->


  </ccm:build>
</ccm:project>
